UID,Company Name,Basisnaam,Salesnav,tRIfINACN,Textkernal ,Bizzy,Company Website,Company Domain,Domein,Company Industry,Company Specialities,Company Employee Count,Company Employee Range,Company Location,Company Linkedin URL,Company Type,Company Year Founded,Company Profile Picture,Company Description,In List?
SN85,Q8,q8,Salesnav,TriFinance,#N/A,#N/A,http://www.q8.be,www.q8.be,q8,Oil and Gas,?,1744,501 to 1000,"Antwerp, Flemish Region, Belgium",https://www.linkedin.com/company/454010,Privately Held,?,https://media.licdn.com/dms/image/v2/C4D0BAQHmbUrlaFANOg/company-logo_400_400/company-logo_400_400/0/1630571366491/q8_logo?e=1733961600&v=beta&t=ACS8xhNoFLpdlRKjA4CvNa-TqR8ICHqseZWFanfyVYk,"As a global company, Q8 is one of the top energy providers in Europe. With close to 5.000 service stations in Europe, of which over 700 in the Benelux region, operating under the brands Q8, Q8 easy and Tango. The main offices in the Benelux are situated in Antwerp (B) and The Hague (NL). 

In Belgium, Q8 also has a strong network of over local 'Shop&Go' convenience stores together with Delhaize, Panos and Starbucks by Selecta. Our loyalty program Q8 smiles grants our customers free Smiles each time they fuel or shop, to save up for nice gifts.

Additionally, Q8 has a highly advanced blending plant for lubricants (Q8Oils) in Antwerp and a state of the art research facility at Europoort (NL). 
International Diesel Services (IDS) focuses on stations for long-haul transport while Q8Aviation offers airport fueling services at international and regional airports.

But we don’t stop there: Q8 has embarked on a transformation journey from a traditional petroleum player to a sustainable Mobility player. Q8 expands its current business by offering sustainable fuels and innovative services to the customer, reshaping the mobility of the future. Q8 has invested in new services such as mobile fueling, E-mobility and Mobility. And will continue to innovate and invest in future-oriented opportunities that make every customer journey more sustainable. ",Yes
SN86,Qbd Group,qbdgroup,Salesnav,TriFinance,#N/A,Consultancy + vacatures,https://qbdgroup.com,qbdgroup.com,qbdgroup,Business Consulting and Services,"Validation, Quality management, Technology transfer, Training (GMP, GAMP5, GLP, GDP), Auditing, GAMP5, Qualification, QbD, QMS, GMP, Serialization, Data integrity, GDP, Consultancy, medical devices, MDR, MDD, biotech, regulatory",388,501 to 1000,"Antwerp, Flemish Region, Belgium",https://www.linkedin.com/company/2295430,Privately Held,?,https://media.licdn.com/dms/image/v2/C560BAQFF8PjvUsGbOw/company-logo_400_400/company-logo_400_400/0/1653039523981/qbd_group_logo?e=1733961600&v=beta&t=I3_t6ZZCEVZdezRtJf_lYA_q1fZN4IXBo622mUZIuN4,"The QbD Group supports life science companies worldwide throughout the entire product lifecycle – from idea to patient. We are a global company with over 650 high-qualified employees.

Our experienced team serves the wider life science industry, with a strong focus on ATMPs, medical devices, IVDs, and digital health, thanks to the specific expertise we have built in these areas. The services we offer fall under the following divisions:

•	Regulatory Affairs: We help our clients in their journey throughout the entire drug and medical device regulatory lifecycle.

•	Clinical: We are an expert clinical solutions provider specialized in medical devices and biotech, offering global CRO services and consultancy.

•	Qualification and Validation: We guarantee that products meet quality demands and comply with regulation through the qualification and validation of your processes, equipment, and software.

•	Quality Assurance: We offer the full range of QA services necessary to get your product to market in a safe and compliant way, including auditing from certified auditors, setting up your QMS, and all QP (Qualified Person) activities.

•	Quality Control: Our QC division consists of a GMP laboratory that offers analytical services for testing pharmaceutical raw materials, excipients, and release testing of finished products.

•	Software solutions: Cloud-based and pre-validated Quality Management Software built for the life sciences, as well as eIFU services which enable IVD and MD manufacturers to digitalize paper Instructions For Use (IFU).

•	Go to market: We help you launch your product to market by providing marketing and communication services, business development support and sales strategy.",Yes
SN87,Robovision,robovision,Salesnav,,#N/A,#N/A,https://robovision.ai,robovision.ai,robovision,"Technology, Information and Internet","Automation, Vision, Robotics, AI, deep learning, machine learning, reinforcement learning, software, Artificial Intelligence, platform, SAAS, PAAS, visual AI, agtech, medtech, deeptech, Vision AI, Smart machines, Quality control, machine vision, vision ai, Industrial automation, computer vision, computer vision software",140,51 to 200,"Ghent, Flemish Region, Belgium",https://www.linkedin.com/company/1069814,Privately Held,2012,https://media.licdn.com/dms/image/v2/D4E0BAQGw2Qg2v5234Q/company-logo_400_400/company-logo_400_400/0/1711611674741/robovisionai_logo?e=1733961600&v=beta&t=PRNej5uhovlLDgUfhyEKjvnc8j2zXBR1RCsn5hfnnok,"Robovision is a central platform to manage vision intelligence. Successfully introduce AI in dynamic environments without the need for AI experts. Runs in the cloud and on the edge.

For our customers it means:

1. Take control of your AI vision in a central place 
2. Minimize down-time of business-critical automations
3. Easily scale-out AI solutions to all your locations globally
4. Avoid dependency on 3rd parties to implement improvements
5. Maximize the ROI of your AI investments

Always looking for experience in AI and scaling companies!  ",Yes
SN88,Samsonite,samsonite,Salesnav,,#N/A,#N/A,http://www.samsonite.com,www.samsonite.com,samsonite,Manufacturing,"Travel, Business, Casual, Umbrellas, Travel accessories, Handbags, Small leather goods, Gloves, Luggage, Backpack, Suitcase, Holiday, Vacation, Samsonite",4168,1001 to 5000,"Oudenaarde, Flemish Region, Belgium",https://www.linkedin.com/company/165833,Public Company,?,https://media.licdn.com/dms/image/v2/C4D0BAQHZsUiGHd2JVA/company-logo_400_400/company-logo_400_400/0/1630580157643/samsonite_logo?e=1733961600&v=beta&t=wowx2dzONssg3JfRI6GbNVC6mLdW7BLmHsLZlXB3an0,"Founded in 1910, Samsonite is the world’s leading luggage brand. Renowned for its breakthrough research and development, and commitment to innovation, Samsonite has excelled since its inception with a number of industry firsts. Samsonite offers an extensive range of travel, business, kids, casual and personal accessory products. Samsonite helps travellers’ journey further, with ever lighter and stronger products. ",Yes
SN89,Sbb Accountants & Advisors,sbbaccountants&advisors,Salesnav,,#N/A,#N/A,http://www.sbb.be,www.sbb.be,sbb,Financial Services,"Accountancy en boekhouding, Fiscaliteit, Consulting, Advies in milieu- en bouwreglementering, Een toffe job in eigen regio",488,501 to 1000,"Leuven, Flemish Region, Belgium",https://www.linkedin.com/company/983168,Privately Held,1971,https://media.licdn.com/dms/image/v2/C560BAQEgj8orM8EUoQ/company-logo_400_400/company-logo_400_400/0/1656670084322/sbb_accountants_and_adviseurs_logo?e=1733961600&v=beta&t=8Rw9GfqAW0FaGeUXE-cR5Mn9oaiOYLImv9xq3NAQDGM,"Welcome to SBB, a firm of experienced accountants and tax consultants with 30 branches in Belgium. 

We provide enterprising people with full support in the fields of bookkeeping, accountancy, taxation and environmental regulations, in every phase of their business – from start-up to wind-down. 

SBB is a member of the worldwide TIAG alliance of accounting firms. That ensures you have access to outstanding accounting services at home and abroad. 

What gives us the edge is our thorough sector-based knowledge and strong ICT support. We also invest in knowledge. Our research department monitors legislation closely, while our consulting department is ready to advise you on your strategic decisions. 

Over 20,000 start-ups, managers, directors and liberal professionals currently benefit from SBB’s personal service.",Yes
SN90,Sd Worx,sdworx,Salesnav,TriFinance,#N/A,>30 vacatures,https://www.sdworx.com/,www.sdworx.com,sdworx,Human Resources Services,"Payroll, HR, Tax & Legal",2979,5001 to 10000,"Antwerp, Flemish Region, Belgium",https://www.linkedin.com/company/16164069,Privately Held,1945,https://media.licdn.com/dms/image/v2/D4E0BAQGl7ruqAs93FQ/company-logo_400_400/company-logo_400_400/0/1688206637674/sdworx_logo?e=1733961600&v=beta&t=Sy5E9MTAVyUmGeh9FoXDTUZbK705Jsjei0F5XDIJiBs,"We spark success at the heart of your business so you and your people can thrive.

About SD Worx  
In today’s new world of fluid work, people want to be inspired by what they do and have the freedom to focus on what matters. Organisations need a dynamic, motivated workforce empowered by smart technology. As a leading European provider of integrated HR solutions, SD Worx turns HR into a source of value for their customers’ business and the people that work for them. SD Worx delivers HR solutions across the entire employee lifecycle, from paying employees to attracting, employing, rewarding and developing the talent who make businesses succeed. SD Worx powers performance through four core capabilities: software, outsourcing, consultancy and data-driven insights.  

SD Worx is the trusted leading European provider of end-to-end HR solutions for all organisations and workers. About 90,000 small and large organisations across Europe place their trust in the company and its +75 years' worth of experience. SD Worx calculates the salaries of approximately 5.7 million employees and ranks among the top five worldwide. The more than 7,500 employees operate in Belgium (HQ), Austria, Bulgaria, Croatia, Czech Republic, Denmark, Estonia, Finland, France, Germany, Hungary, Ireland, Italy, Luxembourg, Mauritius, Netherlands, Norway, Poland, Romania, Serbia, Slovakia, Slovenia, Spain, Sweden, Switzerland and the UK. SD Worx achieved a consolidated revenue of EUR 1.058 billion in 2023. 
 
More info on www.sdworx.com ",Yes
SN91,Sd Worx Belgium,sdworx,Salesnav,TriFinance,#N/A,>30 vacatures,http://www.sdworx.be,www.sdworx.be,sdworx,Human Resources,"Multinational Payroll, HR and Tax & Legal advice, HR Software, Staffing",1893,1001 to 5000,"Antwerp, Flemish Region, Belgium",https://www.linkedin.com/company/165892,Privately Held,1945,https://media.licdn.com/dms/image/v2/D4E0BAQEogdJas2ybGQ/company-logo_400_400/company-logo_400_400/0/1688373882791/sd_worx_belgium_logo?e=1733961600&v=beta&t=_dZqN6kfmaiNdnyqKdun1A0spKiKuqBWewHj-U2lbDw,"In today’s new world of fluid work, people want to be inspired by what they do and have the freedom to focus on what matters. Organisations need a dynamic, motivated workforce empowered by smart technology. As a leading European provider of integrated HR solutions, SD Worx turns HR into a source of value for their customers’ business and the people that work for them. SD Worx delivers HR solutions across the entire employee lifecycle, from paying employees to attracting, employing, rewarding and developing the talent who make businesses succeed. SD Worx powers performance through four core capabilities: software, outsourcing, consultancy and data-driven insights.  

SD Worx is the trusted leading European provider of end-to-end HR solutions for all organisations and workers. About 90,000 small and large organisations across Europe place their trust in the company and its +75 years' worth of experience. SD Worx calculates the salaries of approximately 5.7 million employees and ranks among the top five worldwide. The more than 7,500 employees operate in Belgium (HQ), Austria, Bulgaria, Croatia, Czech Republic, Denmark, Estonia, Finland, France, Germany, Hungary, Ireland, Italy, Luxembourg, Mauritius, Netherlands, Norway, Poland, Romania, Serbia, Slovakia, Slovenia, Spain, Sweden, Switzerland and the UK. SD Worx achieved a consolidated revenue of EUR 1.058 billion in 2023. ",Yes
SN92,Sea-Invest,seainvest,Salesnav,TriFinance,#N/A,>30 vacatures,http://www.sea-invest.be,www.sea-invest.be,sea-invest,"Transportation, Logistics, Supply Chain and Storage",?,490,5001 to 10000,"Luxembourg, Luxembourg, Luxembourg",https://www.linkedin.com/company/70566,Privately Held,?,https://media.licdn.com/dms/image/v2/C560BAQGDT5VkraYQRw/company-logo_400_400/company-logo_400_400/0/1631439633744/sea_invest_logo?e=1733961600&v=beta&t=2PG0ooDm2yaNk_76Uvi8W5dlo9SC9__Jkb_8Ds-JTQ8,"Interested in a position @SEA-invest? Check out our vacancies: https://sea-invest.com/nl/jobs/

SEA-invest is an international terminal operator for Dry Bulk, Fruit & Food, Breakbulk, Liquid Bulk and Containers. Today, the group has established an excellent reputation in the field of stevedoring, transport, warehousing and other port related activities. SEA-invest is active in no less than 24 ports spread across two continents and is integrated in a great number of industries. Combined with its proximity and connectivity, SEA-invest has become a crucial link in its customer supply chain to both the producer and the end user. This website introduces you to a wide range of our activities and to all the companies within the SEA-invest group. Discover what SEA-invest can offer you. Discover an ocean of opportunities!",Yes
SN93,Securitas Belgium,securitas,Salesnav,TriFinance,9,>30 vacatures,http://www.securitas.be,www.securitas.be,securitas,Security and Investigations,?,1663,5001 to 10000,"Machelen, Flemish Region, Belgium",https://www.linkedin.com/company/873326,Privately Held,?,https://media.licdn.com/dms/image/v2/C560BAQGaGR8sbfHC5Q/company-logo_400_400/company-logo_400_400/0/1630661898721/securitas_belgium_logo?e=1733961600&v=beta&t=DU-5ixhEjLNoOvA4NFsEnDDOqiwsDUY6ka4fdWejaak,"See a different world.
Securitas is a global knowledge leader in security. Securitas combines people, technology and knowledge to provide customized and efficient safety solutions. More than 355 000 employees are making a difference in the residential sector, for SME’s, or for major companies, as well as in the public sector. In Belgium, Securitas employs more than 6 600 people.",Yes
SN94,Seris Belgium,seris,Salesnav,TriFinance,#N/A,#N/A,http://www.seris.be,www.seris.be,seris,Security and Investigations,"Security, Technology, Academy, Logistics, Monitoring, Total Security Concept, Guarding, Security systems, Training , Surveillance, Shipments, Integrated security, K9, Patrol, Alarm response, Drones",1114,1001 to 5000,"Machelen, Flemish Region, Belgium",https://www.linkedin.com/company/451678,Public Company,1907,https://media.licdn.com/dms/image/v2/D4E0BAQGxLlgv8GJqzw/company-logo_400_400/company-logo_400_400/0/1704972189381/seris_logo?e=1733961600&v=beta&t=25C_qMStLEIGKOxeuQ4CCsFMPnYZDxjS0KVVaggGgb0,"SERIS is a modern company that offers companies, governments and private customers a Total Security-solution through a creative and pioneering philosophy. By combining our different expertise SERIS offers integrated security services that can be applied to all your security-needs.

With more than 100 years of experience SERIS developed a total offer that fulfills your expectations. 1 group with several companies specialized in their own field.  


SERIS Security nv/sa - BE 0404.770.607
SERIS Logistics nv/sa - BE 0436.369.742
SERIS Technology nv/sa - BE 0475.583.377
SERIS Monitoring (division of SERIS Security nv/sa) - BE 0404.770.607 
SERIS Academy nv/sa (erkende opleidingsinstelling/organisme de formation reconnu) - BE 0890.333.504",Yes
SN95,Showpad,showpad,Salesnav,TriFinance,#N/A,>30 vacatures,https://www.showpad.com,www.showpad.com,showpad,Software Development,"Content Marketing, Sales Enablement, Content Effectiveness, Sales Effectiveness, Content Activation, Marketing and Sales Alignment, Mobile Sales Tool, Sales Readiness, Sales Coaching and Training",399,501 to 1000,"Ghent, Flemish Region, Belgium",https://www.linkedin.com/company/2446860,Privately Held,2011,https://media.licdn.com/dms/image/v2/D560BAQE_gXgfbMfGmQ/company-logo_400_400/company-logo_400_400/0/1708381727035/showpad_logo?e=1733961600&v=beta&t=3xASBEEr0RvQE6tW93d2DyUpBz7V6nRiQp7rgRiMRec,"At Showpad, we're all about helping you tap the full potential of every seller. Our Showpad Enablement Operating System (eOS) brings together your marketing and revenue teams, uniting them around the content, training, and tools that help win deals and grow revenue. eOS is an all-in-one, AI-powered solution that adapts to your unique strategy and tech stack. And wherever you may be in your enablement journey, our team of experts has got you covered.

Showpad has been named a Leader in the Forrester Wave™ Sales Readiness Solutions 2023 report, listed as a top 10 software company by G2, and recognized among Built In’s Best Places to Work 2024.


Showpad has been named a Strong Performer by Forrester’s Wave for Sales Content Solutions, recognized as a top 10 software company by G2, and listed in Deloitte’s Fast 50 and Inc Magazine’s 2019 Best Workplaces. Learn more at Showpad.com.",Yes
SN96,Smulders,smulders,Salesnav,,#N/A,>30 vacatures,http://www.smulders.com,www.smulders.com,smulders,Construction,"Steel constructions, Architectural steel constructions, High-grade industrial constructions, Bridges, EPC Contractor, Offshore Wind Turbine Foundations, Offshore High Voltage Substations",830,1001 to 5000,"Arendonk, Flemish Region, Belgium",https://www.linkedin.com/company/2456316,Privately Held,1966,https://media.licdn.com/dms/image/v2/C560BAQFRqB1MfbJB2w/company-logo_400_400/company-logo_400_400/0/1631437337596/smulders_group_holdco_b_v__logo?e=1733961600&v=beta&t=7lUVMznSECJsG1LETTgIjuTQGsmQomXxf6iw6l3qWqQ,"Smulders is a multidisciplinary and international construction company with branches in Belgium (Arendonk, Balen and Hoboken), the Netherlands, Poland and the UK. We build sustainable infrastructure according to the design & build principle, focusing on civil and industrial projects and offshore wind energy. ",Yes
SN97,Solvint,solvint,Salesnav,,#N/A,Consultancy,http://www.solvint.com,www.solvint.com,solvint,Business Consulting and Services,"Purchasing, Supply Management, Sourcing, Procurement, Supply Chain Management, Inkoop, Aankoop, Logistiek, operations, Operational excellence, End-to-End Supply Chain, Project Management, Organization Development, Interim, Consultancy, Supply Chain, Food Industry, FMCG, Retail, Warehousing, Automotive, Logistics, Process Industry, Telecommunication, Packaging, Medical Industry, Digital",158,51 to 200,"Antwerp, Flemish Region, Belgium",https://www.linkedin.com/company/130003,Privately Held,2003,https://media.licdn.com/dms/image/v2/C4E0BAQFZXSeAdPZmiw/company-logo_400_400/company-logo_400_400/0/1650960335994/solvint_supply_management_logo?e=1733961600&v=beta&t=06kkAO-VV0T1ZCb9j_2d0EjtSaa7Lhjq4RqGyBK5qZA,"Solvint is a European expertise firm in end-to-end Supply Chain Management (Plan, Source, Make, Deliver), with offices in France, Belgium, the Netherlands and Switzerland.

A team of more than 150 experienced professionals serves more than 100 local and international clients. 

SOLVINT supports organisations in managing key business challenges, when they face:
- Significant growth, leading to expansion of their supply chain footprint and capabilities
- Resource constraints, leading to a need for flexible expertise to manage temporary resource gaps
- M&A activities, leading to the need for specific expertise to ensure correct valuation and smooth integration
- Margin pressure, leading to the need to reduce cost and improve EBIT
- Workforce model redesign, leading to the need to create an agile structure balancing internal capabilities with external expertise
- Organisational changes, leading to the need for specific capabilities or capacity to ensure a smooth transition 

SOLVINT is focused on 3 key areas:
- EBIT Improvement: EBIT improvement projects
- Plug & Play Expertise: Domain experts for capability or capacity needs
- Org. & People Development: Organisational development projects, training & workshops

Our services have a direct and measurable impact on your company’s performance.

NEED AN EFFECTIVE, FAST AND FLEXIBLE SOLUTION?
There is no such thing as a ‘one fits all’ solution! Solvint embraces a customer oriented approach. Your specific requirements are the basis for our tailor-made proposal. After a non-binding short intake meeting we present you our suggestions for an effective and result-oriented approach.

Contact us at info@solvint.com",Yes
SN98,Spacewell | A Nemetschek Company,spacewell|anemetschekcompany,Salesnav,,#N/A,#N/A,https://spacewell.com,spacewell.com,spacewell,IT Services and IT Consulting,"proptech, IWMS, Digital Twin, building management software, BIM for FM, facility management software, workplace management software, workplace experience software, space monitoring, comfort monitoring, air quality monitoring, building IoT, smart building, smart workplace, agile workplace solutions, space optimization, SaaS, Workplace analytics software, CPIP",203,201 to 500,"Antwerp, Flemish Region, Belgium",https://www.linkedin.com/company/19036603,Public Company,?,https://media.licdn.com/dms/image/v2/C560BAQEUHI5I4JzUCQ/company-logo_400_400/company-logo_400_400/0/1630623883967?e=1733961600&v=beta&t=2XCRfJ9paR2IYyI-fwK3s2SOXJ3ypLKrGVPFZXduAL4,"Spacewell, a Nemetschek Group company, is a technology and consulting firm, supporting its clients across the globe to improve the performance of their building portfolios. Our core purpose is to make buildings work harder for their occupants by unlocking the power of building data. We assist our clients to optimize their facility operations and achieve bottom-line savings. And we help them create workplaces that offer the agility, flexibility, and connectivity needed to support new ways of working.

The Spacewell offering consists of:
-	IoT-connected Spacewell Workplace SaaS platform for 
        - Workplace Analytics
        - Workplace Experience
        - Workplace Management
-      AI-powered Energy management software (Dexma)
-	Maintenance software (planning, inspections, execution, compliance)
-       Independent advisory services delivered by domain experts (Advisory)

Spacewell is an Accredited Solution, by @Wiredscore. The Spacewell solution is also accredited against the Smart Building Certification (SBC)  framework.

To learn more, please visit: www.spacewell.com

#IWMS #CPIP #smartbuildings #PropTech #WorkTech #digitaltwin #CRE #software #BuildingIoT #realestate #workplace #facilitymanagement #energymanagement #buildingmaintenance
ment",Yes
SN99,Stefanini Emea,stefaniniemea,Salesnav,,#N/A,Consultancy,https://stefanini.com/en/emea,stefanini.com,Stefanini,IT Services and IT Consulting,"Managed Services, Systems Integration & Development, IT Infrastructure Outsourcing, Application Lifecycle Management, Social Media Monitoring, SAP Consultation, SAP Deployment, Business Process Outsourcing, eClinical support, Application Development, Digital, Augmented reality, Artificial intelligence, Cybersecurity",2079,10001+,"Zaventem, Flemish Region, Belgium",https://www.linkedin.com/company/166287,Privately Held,1987,https://media.licdn.com/dms/image/v2/C4E0BAQGjv1pQWIx1SA/company-logo_400_400/company-logo_400_400/0/1630655735664/stefanini_emea_logo?e=1733961600&v=beta&t=aMli584B9QjX-oFzxj5Wua-m7ObYsYB3fdPeRoMTtO0,"Stefanini is a global company with over 35 years of experience in accelerating digital transformation. We co-create alongside our clients by helping them embrace modern technology and innovative solutions for their current portfolio. 
Our digital capabilities and industry expertise can help redesign products and services.
We offer a diverse selection of technology solutions including digital workplace, cybersecurity, artificial intelligence, cloud, agile development, automation, next gen applications.
Stefanini EMEA is present in 16 countries with 11 offices. 
Our 2,600+ employees reshape the workplace by helping clients with their digital transformation journey. We help our clients and partners embrace the power of change by offering: Information Technology Outsourcing services, including IT support in 35 languages, application development, IT systems configuration and ERP/SAP counselling.
Main Stefanini EMEA locations:
-Romania
-Belgium
-Moldova
-Poland
-Spain
-Portugal
-Netherlands
-Germany
-Switzerland 
-Italy
-Greece
-Sweden
-Denmark
-France
-Hungary
-United Kingdom
",Yes
SN100,Stg,stg,Salesnav,,#N/A,#N/A,http://www.stg-group.be,www.stg-group.be,stg-group,Wholesale,"Sanitair, Wellness, Verwarming, hernieuwbare energie",693,501 to 1000,"Herentals, Flemish Region, Belgium",https://www.linkedin.com/company/2312217,Public Company,1979,https://media.licdn.com/dms/image/v2/C560BAQGXA09RG2j80Q/company-logo_400_400/company-logo_400_400/0/1630668190180/schrauwen_sanitair__verwarming_logo?e=1733961600&v=beta&t=gu1D9ShuFSUeoldDHLpY7lw1EktNNlwfemp9Dyc1unM,"Wij zijn STG, oftewel  Sanitair Technische Groothandel. De nationale groothandel in sanitair, verwarming en installatietechnieken. De klantgerichte speler die adviseert en inspireert. En daarbij geen technische uitdaging uit de weg gaat. 

In onze ProShops staan we onze professionele klant graag met technische raad en daad bij. In onze toonzalen begeleiden we met plezier de (ver)bouwprojecten van onze particuliere klant.

Met al onze ervaring en expertise bouwen we samen verder aan de beste service, een winnend assortiment, de juiste voorraad, de mooiste inspiratie én deskundig advies. Elke dag opnieuw. Elke dag beter. STG heeft het!",Yes
